comment_id,comment_text,like_count,published_at
Ugx2Jre7aPmA2Hq4vOZ4AaABAg,"🎯 Key Takeaways for quick navigation:

00:00 *📈 Streaming service prices are on the rise, impacting the affordability of multiple subscriptions.*
00:32 *🤔 The increase in streaming costs prompts the question of how consumers can better manage these expenses.*
01:06 *🚀 Netflix's business strategy focuses on increasing subscriber numbers and prices to offset its $15 billion debt.*
01:33 *📊 Despite price hikes, Netflix experienced unprecedented growth during the pandemic.*
02:02 *📉 In 2022, Netflix faced subscriber losses, marking a significant shift in its growth trajectory.*
02:32 *🔒 A strategy shift towards converting password sharers into paying subscribers briefly boosted Netflix's subscriber numbers.*
03:05 *📺 Hulu successfully capitalized on its ad-supported tier, showing the profitability of including ads in streaming services.*
03:35 *🛒 Most streaming services now offer ad-supported options to attract more subscribers and enhance profitability.*
04:03 *💸 Rapid expansion and competition against Netflix led new streaming services to incur significant financial losses.*
04:30 *🎥 Dedicated fans of films and TV shows may find the higher costs of streaming services a worthwhile investment.*
05:00 *🔄 ""Serial churners"" manage costs by subscribing to services only when desired content is available, reflecting a strategic approach to streaming.*
05:29 *📅 Some consumers opt for a hybrid strategy, maintaining core subscriptions while rotating others to save money.*
05:59 *🔄 The flexibility to choose and pay for only desired content was a foundational appeal of streaming services, a principle increasingly tested by rising costs.*

Made with HARPA AI",0,2024-04-12T18:23:14Z
UgwJiumd2eqnj7dOrg94AaABAg,i just pirate things,0,2024-04-12T18:12:46Z
UgwB5FpfzZQ2qb0kFFp4AaABAg,"You know its coming! At software pricing where a monthly subscription that you can cancel is a higher price than a yearly agreement paid monthly.
Now it all adds up to the cable TV bill you were trying to avoid when you ""cut the cord"" because they all want your money.",0,2024-04-12T18:07:40Z
UgxVcRkLY-GdXUEC9wd4AaABAg,its ok...well just go back to downloading,0,2024-04-12T16:57:20Z
Ugye_nj_u88tQoJoLU54AaABAg,kind of rare for vox not to address the elephant in the room,0,2024-04-12T16:33:14Z
Ugwp5V838T64iH6NBt94AaABAg,"Man IDK, I'd like to just stick with Comcast and maybe 1-2 streaming services but I used to get Comcast Internet/TV, etc.. for like $155/month and Neflix was $10, and maybe like another stream was $10.  I was all in on tv/internet/streaming for like $175/month.  Now Comast is $225/month for the same service, Netflix is I don't even know like $16-17/month, and we have 1 or 2 more streaming services.  We are paying closer to $250 than $175.  I've always been in the stick with cable column but IDK, might be time to jump because of cost.",0,2024-04-12T15:56:41Z
UgxJiU6GAXBfUjMHxSd4AaABAg,VOX videos feel like the opening of a great documentary but then they just end mid sentence LOL,0,2024-04-12T15:38:35Z
Ugz-RZoEyT3wIUqpzh94AaABAg,It used to be 100% free. And it is still. Lot of people are just too ignorant to realise.,0,2024-04-12T15:38:27Z
Ugy3i5sCE9OVwK1TRkJ4AaABAg,"weirdly, unless you have access to a public library, reading (without piracy) can be even more expensive.",0,2024-04-12T15:10:08Z
Ugw2s2VHO7dxunxTnUh4AaABAg,"Or, do not pay any subscription? Sail the high seas :)",0,2024-04-12T13:26:21Z
Ugz8AyZYJ-2No2soqkt4AaABAg,The solution is going back to piracy and it’s going great,0,2024-04-12T12:00:27Z
Ugwx7F6GYg5dOGjkQaB4AaABAg,Torrent meanwhile 🚬💨,0,2024-04-12T09:17:45Z
UgzcvUUnze_ElV0U2Qh4AaABAg,Watch it for free online😂,1,2024-04-12T09:17:28Z
UgzCR5jZUCpf0G_hABZ4AaABAg,it isnt over.visit gamsgo,1,2024-04-12T08:57:29Z
UgxlENhTuBPtx9Co0AV4AaABAg,who cares about cheap streaming when you can get free streaming,0,2024-04-12T08:44:56Z
UgzpOdYyzi69OfANWPV4AaABAg,yarrrrr,0,2024-04-12T08:29:32Z
UgzrIVlL-ojqi117G0N4AaABAg,"I watch 1 or 2 shows per year. If you have all these services, you're watching way too much. Imagine if we socialised more instead.",0,2024-04-12T06:05:24Z
UgyhhOAVOWM6twsUxLd4AaABAg,"The reason Netflix is so popular is it had ""everything"" and it was all you needed. It was a good concept, until they started producing their own content, and competitors copied that model. Now you have a series of walled gardens with exclusive content. If all content was cross-licensed, we could pay a little more for one service which has the UI and performance we like.",0,2024-04-12T05:58:51Z
Ugziu-ycfa05f4SFCY54AaABAg,It will probably come around... piracy is getting easier and safer nowadays.,0,2024-04-12T05:24:52Z
UgxP9reIol-IwPGGivV4AaABAg,"Streaming services became fragmented thus it feels like cable TV again. More and more people now are returning to piracy since their convenience is ruined by these greedy corporations.

If music record labels start doing the same thing as these streaming service companies, they would probably face the same thing and people would flock back to Napster or Limewire all over again.

As for digital game storefronts, Steam remains supreme as it's still the top platform where people buy games. Others tried to compete with Steam. But, sadly, they failed and most of them are even returned to Steam again.",0,2024-04-12T04:00:01Z
UgxD1r89_B6x-Q2P7BJ4AaABAg,"Churn’n’burn, Baby … Churn’n’burn … 🔥 💵",0,2024-04-12T03:34:28Z
UgzySOBEtKIhSOjNXpF4AaABAg,"Lad, the era of anything cheap is over. 😅",0,2024-04-12T02:31:49Z
UgwUWhNUtRz9903Kw7h4AaABAg,"I found this video to be lacking data, it wasn’t very informative.",0,2024-04-12T01:54:37Z
Ugz032mgYijTeo-km3F4AaABAg,Pirate,0,2024-04-12T00:01:04Z
UgwcgTWRfsoff95lTqR4AaABAg,I cancelled Disney and Netflix this month. Im tired of their bull****,0,2024-04-11T22:58:29Z
UgxLHFTs01RuNhvRrvN4AaABAg,The nice thing is at the end of the day it's all just mp4s,0,2024-04-11T22:57:14Z
UgwstSdqCLECzR1QDj54AaABAg,"So sad that someone spend so much money in TV subs, and cries about it",0,2024-04-11T22:06:57Z
Ugzgajbe6BDqQTdhw294AaABAg,"the best being not having much of those services and use time much more effectively than binge watching series. I'd rather pay for Youtube Premium where I can watch lots of interesting, creative and independant content without Ads and rewards those same creators with my view time.",0,2024-04-11T21:45:56Z
UgzBHHCoApgmPyxug9p4AaABAg,If you are a teen and can't afford cuevana is the noodle secret,0,2024-04-11T21:41:41Z
UgxjSB10vj_jHN6-pOl4AaABAg,"Thankfully the illegal streaming sites I use have also upped their game. Now always have subtitles, playback speed & a great netflix esque homepage full of the new stuff that's trending with quality that's always amazing. I was a child of illegal streaming & caught the backend of limewire etc in early to mid 2010s to download music etc. But I happily pay for certain subcriptions like music, storage etc & also prime & Netflix for like 8 years straight, without evening pasword sharing cause the price was fair & full content. But now the illegal sites have caught up & Netflix has generally become something I don't watch as much I stopped paying 1 year ago & didn't look back. Still happy with apple music & think it's worth the £. Also don't have to google which sreaming platform to watch stuff on anymore :). The business model was to replace costly typical TV packages, but instead there's like 4-5 big streaming sites which defeat the purpose & make it complicated.",0,2024-04-11T21:29:59Z
UgwzfhGY_zUBjyyhJ-B4AaABAg,how do i make my streaming diet work for me?  i just use plex,0,2024-04-11T21:04:43Z
UgycbJ6PkYXO3EG04dJ4AaABAg,All these high prices making people set sail for One Piece,0,2024-04-11T18:07:25Z
UgxmkqOWirEx8kCd1mx4AaABAg,"I canceled them all. There's places where you can watch stuff for free. But, these sites often get shut down.",0,2024-04-11T18:05:20Z
UgwtclogUUXUCr-YAIl4AaABAg,"I didn't know that it had a name for it, but I was a ""churner"" since the beginning, and then started sailing the high seas.",2,2024-04-11T17:37:15Z
Ugyfr4EA3n8_jRZb2F94AaABAg,"Serial churner for main services, explorer of the 7 seas for the odd thing here and there. Companies expecting infinite growth has been unrealistic and disrespectful. If they show no respect to their customers by raising and raising and raising then they have to expect customers to show no respect or loyalty in return. I used to leave Netflix active even when I didn't use it that much just because it was cheap enough, but now prices are well out of hand so I churn services, and now each one gets less from me in the end. It's a lose-lose scenario created by unrealistic and greedy business practices.",0,2024-04-11T17:34:51Z
UgxvKkPYEr9So9LVEfR4AaABAg,So now it’s just TV. Got it.,0,2024-04-11T17:12:59Z
UgzlWy-THMiktLfc4qZ4AaABAg,all i say to this is goojara >:),0,2024-04-11T17:08:59Z
UgwutBZhEAXF0aTumCd4AaABAg,Jokes on you. I hardly watch anything now.  If youtube even prompts an ad I close out.  I have so much more free time now.,0,2024-04-11T16:46:00Z
UgwfKpOPgsVmx4n4N0d4AaABAg,It’s hilarious that the folks screaming for streaming to “show those cable tv companies” we won’t take it thought that streaming services wouldn’t also want to make a lot of money,0,2024-04-11T16:36:49Z
Ugw1ijAwzltGsVEyjy94AaABAg,"This video was a whiff, yes debt/subscriber loss is part of it. But media relationships and licensing have the biggest impact on long term costs. Especially sports licensing which will need to be a part of all media streamers success",0,2024-04-11T15:48:52Z
UgyDiJgK_SvxZAakKRp4AaABAg,I'm going back to books that I checked out for free at my local library,0,2024-04-11T15:39:07Z
Ugx9_Jgy6JFiSrwcoN54AaABAg,Watch illegal streams 🎉,0,2024-04-11T15:03:58Z
UgwEl_Zi68AYqkW4fFZ4AaABAg,Remember when literally everything was on Netflix? I miss those days...,2,2024-04-11T14:45:44Z
UgywHB-gJkl40MSPR-x4AaABAg,"Why is nobody talking about the fact that we got away from cable TV and onto streaming because it was cheaper and lacked ads, and now streaming is starting to have just as many ads and is slowly becoming MORE expensive than cable was. Streaming sites used to be where indie film makers and such could showcase their content, but now nobody watches TV anymore to the point where it's becoming the new indie, and cheaper option. I wonder if we'll just keep jumping back and forth forever, forever chasing those cheaper ad free platforms",0,2024-04-11T14:20:43Z
UgxPjN3BtJsyg9sD_od4AaABAg,"You've forgotten another option: sailing the high seas, and become free. Cost is way lower, and depending on your needs you might just use a laptop o desktop; without the need for a dedicated media server",34,2024-04-11T14:06:16Z
Ugx7FPsciW8lt8HDBdF4AaABAg,Yo ho ho and a bottle of rum ladies and gentlemen!,1,2024-04-11T13:41:08Z
Ugz82eeSNZ7NHabuFPl4AaABAg,the only answer is to become a pirate,1,2024-04-11T13:22:01Z
Ugz17js-kdAgKJjee4J4AaABAg,Yo ho yo ho a pirate's life the life for me!,1,2024-04-11T13:19:47Z
UgxftVQFZXxr_qHSuJh4AaABAg,"Because of cable DVRs and streaming, I haven't watched an ad in almost 20 years. Ads are insipid, vapid, and vacuous, So I will always pay more to not see ads.",0,2024-04-11T13:11:40Z
Ugwvw_wri8hfJsihRqB4AaABAg,have you ever heard of torrent?,0,2024-04-11T12:49:41Z
Ugw6scZNltLjesSjflp4AaABAg,"Just pirate everything. No ads, Higher quality, everything on the same app, permanent offline content. Forgotten content, content not available in your country.",8,2024-04-11T12:30:16Z
Ugw2-wbSDs0wiSMBDat4AaABAg,Things have gotten so bad with the number of streaming services and pricing that I've just gone back to pirating.,0,2024-04-11T12:05:50Z
UgzmBBa13L7-00v1w5x4AaABAg,Avoiding FOMO is also nice. You don't have to watch all the movies and series available. You won't have enough time.,0,2024-04-11T11:50:51Z
UgwcGgDFUghnDXoL1iV4AaABAg,"Personally, I just don't watch TV shows at all. When I really want to see something, I might subscribe to a streaming service for a month or so, or I just buy the show. But I feel like a lot of people just have TV shows constantly running in the background, not even watching actively, and I think that's a bad way to consume art to begin with. I also don't need to see everything out there.",0,2024-04-11T09:15:38Z
UgyC7y2WYfoX3KbX9Vh4AaABAg,"I'm glad I'm using Telkomsel because when I bought internet package, it comes with monthly Prime subscription",0,2024-04-11T08:33:31Z
Ugzra-TnBjqE3sgb3pp4AaABAg,awesome editing,0,2024-04-11T08:13:46Z
UgwxWg3uLZnhZmqL1ql4AaABAg,"Have a walk, watch the world around you.",2,2024-04-11T07:07:41Z
UgyP_Fx6LJ7PDrr-_Gt4AaABAg,"But why do companies have to constantly grow?  If they're profitable, shouldn't that be enough?",0,2024-04-11T04:50:53Z
UgzS70i78g5T5UXfL654AaABAg,greed,0,2024-04-11T04:13:51Z
UgxoDZmToruNm-7jVb54AaABAg,"No time for watching all, no money if you watch em all 😅",0,2024-04-11T00:31:46Z
UgyhGvPklKRf8CYdzWx4AaABAg,yaar,0,2024-04-10T22:44:08Z
UgywJfAaz5hew69kvPp4AaABAg,Love how these companies refuse to look inwards at some of the garbage they produce for excessive budgets. Compare the grey man $200m vs the creator $80m.,0,2024-04-10T21:55:49Z
Ugx4MiOh_bzZDzRHK9Z4AaABAg,"All in all I don’t suscribe to any service, borrow one account and watch on free with ads services or open TV. My ideal situation would be for all of those service to broke down, go back to everything in Netflix and everyone else working for these animals is fired.",0,2024-04-10T20:07:31Z
Ugz-JqRJbPdSzuXpF5N4AaABAg,arggh matey,0,2024-04-10T19:43:51Z
UgygWBwzsu3VAli_fjZ4AaABAg,"Paying for all those services indefinitely sounds so bizarre, like you don't leave your car running and your stove on while you're away. Paying for more than a single service per month would already be an anathema to me.",0,2024-04-10T19:16:45Z
UgxZiGeEMQjU7VXFp_94AaABAg,Piracy and that’s what we’re heading towards. paying for 1-2 streaming platforms and pirating that 1 show or 1 movie that just so happens to be on another platform you don’t pay for,0,2024-04-10T19:13:56Z
UgxOdXI7dSeHHtEvWi54AaABAg,Remember bootleg dvds? If u think that ppl wont find a way to watch shows/movies they like without paying or for a cheaper price u better think again.,2,2024-04-10T18:53:50Z
UgwMG5b0yhjc16ojyrR4AaABAg,"Maybe read a book, man.",0,2024-04-10T18:36:27Z
UgzwYJoM6X_T85Gt9j54AaABAg,Iptv.,0,2024-04-10T17:55:11Z
UgytFyihwtPnBeedCOV4AaABAg,"Radio to Streaming music, cable to streaming apps. It’s a new cycle every decade. We’re gonna be watching movies on vr headsets in 10-15 years.",0,2024-04-10T17:29:49Z
UgwgJ5y8AWU7veyiunJ4AaABAg,Ima sail the high seas and become a pirate,0,2024-04-10T17:02:13Z
UgzSoTQmpo3OGt3h2zp4AaABAg,A pirate's life for me,0,2024-04-10T16:53:43Z
UgxqSOqvSwvkd3xQPQh4AaABAg,I can't believe you watch this slop. Are you intentionally trying to be a stereotypical yuppie?,0,2024-04-10T16:24:22Z
Ugzgcwrrv2V4wmgBDot4AaABAg,"Another flaw is that content itself is getting worse , they're just constantly pumping low quality shows and canceling much of them later .. even if a show turns out to be good , it's always threatened to be canceled. 
Another issue to quality is that most shows are now planned for one season at first , until they succeed, then they get completed with high expectations on board and poor story and production coordination.",0,2024-04-10T15:51:59Z
UgykNw8Sp0jckv5xESt4AaABAg,"I would argue that if netflix stopped cancelling shows and stopped putting out complete garbage, they wouldn't have lost subscribers.",0,2024-04-10T15:44:21Z
Ugx61FDOyb-t0O7tgQt4AaABAg,"Yar, those scurvy landlubbers who still subscribe are being left behind.",0,2024-04-10T15:42:21Z
UgxREPC59iqkMAZG3Gx4AaABAg,Go outside!!,0,2024-04-10T15:07:12Z
UgxDGk64RMHymf1Yszh4AaABAg,how can you possibly subscribe to all those streaming services??,0,2024-04-10T14:50:18Z
UgwOr3BA8mKTyCAgNI94AaABAg,"I'm a churner. I only have the $2.99 version of hulu, and I used a bl0ck3r so I actually don't even have ads. Then like maybe once a year I'll subscribe to something else for a month only to watch a specific thing.",1,2024-04-10T13:37:56Z
UgzcsBLn8DiaglDWpiV4AaABAg,Torrenting is as cheap as ever,0,2024-04-10T13:31:52Z
UgwPYDTvwL2crNIeGrN4AaABAg,I follow Louis Rossman so this thing is not for me 😂,0,2024-04-10T11:59:35Z
UgxmDKYEHflG_NdrHxZ4AaABAg,Wait...this guys wallet has a zipper?!,0,2024-04-10T11:49:00Z
UgyPVPK5zxoFK9dSfn94AaABAg,"Renting TV shows and movies going to be back on the menu. Oh but now Netflix doesn't release all of it's originals on physical disk. Bet everyone forgot this is the reality streaming is turning the world into, subscribe or piracy being the only option, taking choice away.",0,2024-04-10T11:42:10Z
UgzgFwhUacisdZ2RH7p4AaABAg,Streaming is still cheaper than it was before the Netflix era,0,2024-04-10T08:48:56Z
Ugwz4kFwQ_IIaEHYypZ4AaABAg,Since when do liberals oppose competition?,0,2024-04-10T08:46:06Z
UgzKxX-CyZ4E5a76hix4AaABAg,1.	i need to buy movies 1. from up poppy hill to 2 earthsea to 3 castle sky and 4 finding nemo!!!!!!!!!!!!!!!!!!!!!!!!!!!!!!!!!!!!!!!!!!!!!!!!!!!!!!!!!!!!!!!!!!!!!!!!!!!!!!!!!!!! 80 dolllars!!!!!!!!!!!!!!!!!!!!!!!!!!!!!!!!!!!!!!!!!!!!!!!!!!!!!!1,0,2024-04-10T08:19:00Z
UgzXckP9ETCk1wAGmY14AaABAg,1.	i need to buy movies 1. from up poppy hill to 2 earthsea to 3 castle sky and 4 finding nemo!!!!!!!!!!!!!!!!!!!!!!!!!!!!!!!!!!!!!!!!!!!!!!!!!!!!!!!!!!!!!!!!!!!!!!!!!!!!!!!!!!!! 80 dolllars!!!!!!!!!!!!!!!!!!!!!!!!!!!!!!!!!!!!!!!!!!!!!!!!!!!!!!1,0,2024-04-10T08:18:57Z
UgwcFklpmP8NvjEalLp4AaABAg,1.	i need to buy movies 1. from up poppy hill to 2 earthsea to 3 castle sky and 4 finding nemo!!!!!!!!!!!!!!!!!!!!!!!!!!!!!!!!!!!!!!!!!!!!!!!!!!!!!!!!!!!!!!!!!!!!!!!!!!!!!!!!!!!! 80 dolllars!!!!!!!!!!!!!!!!!!!!!!!!!!!!!!!!!!!!!!!!!!!!!!!!!!!!!!1,0,2024-04-10T08:18:54Z
UgxjyosO_LXK8vEc9ph4AaABAg,1.	i need to buy movies 1. from up poppy hill to 2 earthsea to 3 castle sky and 4 finding nemo!!!!!!!!!!!!!!!!!!!!!!!!!!!!!!!!!!!!!!!!!!!!!!!!!!!!!!!!!!!!!!!!!!!!!!!!!!!!!!!!!!!! 80 dolllars!!!!!!!!!!!!!!!!!!!!!!!!!!!!!!!!!!!!!!!!!!!!!!!!!!!!!!1,0,2024-04-10T08:18:52Z
Ugym5YvfGEqZT_VOTmh4AaABAg,1.	i need to buy movies 1. from up poppy hill to 2 earthsea to 3 castle sky and 4 finding nemo!!!!!!!!!!!!!!!!!!!!!!!!!!!!!!!!!!!!!!!!!!!!!!!!!!!!!!!!!!!!!!!!!!!!!!!!!!!!!!!!!!!! 80 dolllars!!!!!!!!!!!!!!!!!!!!!!!!!!!!!!!!!!!!!!!!!!!!!!!!!!!!!!1,0,2024-04-10T08:18:49Z
UgzHjL-R2MFjg2xVNId4AaABAg,1.	i need to buy movies 1. from up poppy hill to 2 earthsea to 3 castle sky and 4 finding nemo!!!!!!!!!!!!!!!!!!!!!!!!!!!!!!!!!!!!!!!!!!!!!!!!!!!!!!!!!!!!!!!!!!!!!!!!!!!!!!!!!!!! 80 dolllars!!!!!!!!!!!!!!!!!!!!!!!!!!!!!!!!!!!!!!!!!!!!!!!!!!!!!!1,0,2024-04-10T08:18:35Z
Ugx4Caj_RpG89jL1TM94AaABAg,1.	i need to buy movies 1. from up poppy hill to 2 earthsea to 3 castle sky and 4 finding nemo!!!!!!!!!!!!!!!!!!!!!!!!!!!!!!!!!!!!!!!!!!!!!!!!!!!!!!!!!!!!!!!!!!!!!!!!!!!!!!!!!!!! 80 dolllars!!!!!!!!!!!!!!!!!!!!!!!!!!!!!!!!!!!!!!!!!!!!!!!!!!!!!!1,0,2024-04-10T08:18:31Z
UgyHeH60_q5y00oNmYB4AaABAg,both 1. youtube and 2. netflix are becoming so much more expensive!!!!!!!!!!!!!!!1,0,2024-04-10T08:18:21Z
Ugxv71ecxiEZLqYQQx14AaABAg,both 1. youtube and 2. netflix are becoming so much more expensive!!!!!!!!!!!!!!!1,0,2024-04-10T08:18:18Z
Ugzzc1UlwbDx7rMtFGd4AaABAg,i need to buy: 1 food 30 2. movies 30 3.  allergy medicine 30 for zyrtec and 4. 30 for transportation!!!!!!!!!!!!!!!!!!!!!,0,2024-04-10T08:18:13Z
UgybBRVAeN9niwp6K214AaABAg,both 1. youtube and 2. netflix are becoming so much more expensive!!!!!!!!!!!!!!!1,0,2024-04-10T08:18:10Z
UgwJfnLm9wjcV0dQ7vN4AaABAg,both netflix and youtube are beocming so much more expensive!!!!!!!!!!!!!!!!!!!!!!!!,0,2024-04-10T08:17:24Z
UgxAJhTP1gSstpTv2Ap4AaABAg,But who is the biggest streaming service out there? YOUTUBE!,0,2024-04-10T07:38:32Z
Ugy54AkhhhTO-M9srVh4AaABAg,well i mostly download pirated movies so....😅,0,2024-04-10T05:29:52Z
Ugyn1yVEqislsrh2net4AaABAg,One Youtube premium to rules them all,0,2024-04-10T04:43:21Z
UgxEJQFyg9lJeIhWes54AaABAg,"All streaming services were subsidized for years just to get more subscribers, now you are paying the real price for the service.",0,2024-04-10T04:18:58Z
Ugy1tO0HwDqVQsenTYZ4AaABAg,Back to the era of free streaming. Avast mates.,0,2024-04-10T03:53:59Z
UgyggFStbLtpDJbifGV4AaABAg,Just watch less TV,0,2024-04-10T03:48:16Z
UgyAL6cDfQax4S_DepB4AaABAg,Or you know... maybe pick up some .50c DVDs at a thrift store. Because you can't even PAY for streaming on some movies and TV shows (Young Frankenstein by Mel Brooks as of 4-9-24) . Combine that with library streaming apps like Hoopla and you've got an even more cost-effective solution.,1,2024-04-10T03:41:51Z
UgyJV-Pqz5MQwVDwCaN4AaABAg,One word: Yarr!,0,2024-04-10T03:32:57Z
UgzPHb5FnjP45G2Buel4AaABAg,there aren't even any interesting shows on these streaming services,0,2024-04-10T03:18:19Z
Ugzp4mtoByMpD2TAo154AaABAg,lol such a nothing/common sense episode from Vox. Can’t all be home runs I guess.,0,2024-04-10T03:12:26Z
UgyzCmblyVS1J4LmSnB4AaABAg,Argh! Avast!,0,2024-04-10T02:19:07Z
UgxJPdYq7745cwsVZyx4AaABAg,"I tried stremio + torrentio once, and cancelled all my subscriptions without regrets. They have all shows in a single app",0,2024-04-10T02:00:57Z
UgwBIpk9QeAREeHzBUF4AaABAg,Haha. Sailing making a comeback then?,0,2024-04-09T23:56:27Z
UgxZk2jwohZpa22WP_F4AaABAg,One must be silly to subscribe to multiple streaming services simultaneously. Much better to subscribe to one at a time.,0,2024-04-09T23:31:39Z
UgxDS87bG1pPl-aHcz94AaABAg,i just downvote Vox. it's how i roll,2,2024-04-09T22:58:44Z
UgzwAOKKU_uTZuXMQ9F4AaABAg,"I know monopolies are horrible, but man, streaming was so much better when Netflix had zero competition. You could find just about anything you wanted to watch and it was cheap. For a time I barely pirated anything. I only have Netflix (included with T-Mobile), Hulu (included with Spotify), and Amazon and I literally never use them now that they all have ads. I torrent everything, even when it's on a platform I'm subscribed to.",0,2024-04-09T21:48:08Z
UgzyOFkKizU8hGw-hkl4AaABAg,god i love piracy,1,2024-04-09T21:25:32Z
UgwiGMMB7JCptDUpech4AaABAg,5 dollar monthly vpn and pirating is more better than having 4 streaming services costing a total about 50 dollars a month.,0,2024-04-09T20:18:04Z
UgzH5jIolJid8CNgHfZ4AaABAg,“It’s the kind of thing you might be willing to invest in.” @Vox your next video should be tell me more about how marketers are using financial illiteracy to promote purely consumptive behavior.,0,2024-04-09T20:11:08Z
UgzB3w10ibmbUl_IaVZ4AaABAg,"This video has nothing to do with the title, still do not know why the era of cheap streaming is over...",0,2024-04-09T20:08:54Z
Ugw8J5mcPdxRIGOht6l4AaABAg,"Cable was always kinda of expensive, and streaming, in the end, is just a more practical way to replace cable. The great technology leap was that, moving things from satellite dishes to the internet, which cut for customers the cost of renting those boxes or carrying those useless channels. But content didn't became cheaper to the point it justified the low starting prices, even with all the outsourcing and shenanigans. Worse, many of these companies chose to build their own libraries, which made them take debt. So, in the end, price was always bound to go up.",0,2024-04-09T19:56:17Z
UgwC2doU_YHBGhpqZFh4AaABAg,why don't more people pirate lol,1,2024-04-09T19:47:14Z
UgzDLYoGL9otyRhhwH14AaABAg,"6:13 I find it a bit weird but so cool at the same time how I get how SZA feels. Like EXACTLY how she feels. Being an artist and having a track out that you don't really feel like that which got people in theirs feels is a very intriguing experience. You want to apologise almost - not for making the song because a lot of the time the process was enjoyable, cathartic etc, but more for not being able to like the song with your supports and fans alike. You can't bond over it which, as the song's literal maker, feels nearly like living in cellophane in that you can see everything going on outside but can't participate or even think straight over the loud crinkling of what separates you from the outside world.",0,2024-04-09T18:32:24Z
UgyMTeSsGYFfTtvCfWN4AaABAg,"I just pirate them all, free, no ads",1,2024-04-09T18:28:07Z
UgxyrWZev_QCjMh0_7R4AaABAg,"just pirate bro. Its free, its quick, its convenient and it has it all.",2,2024-04-09T17:22:31Z
Ugz8RvhiNVYW02ChOoh4AaABAg,TikTok is free,0,2024-04-09T17:19:32Z
Ugw3cnaG2AorK_BpfjN4AaABAg,We're going to see a boom of piracy much like the 2008-2013 years. Streaming was supposed to be the affordable and accessible platform but now it's just cable with extra steps. I've been hopping around platforms since late 2022 and it does save a lot of money.,2,2024-04-09T17:15:31Z
UgwVzgOQD2_WrKZ1LwF4AaABAg,I must have missed the part where they explained the title of this video,0,2024-04-09T17:09:09Z
UgzGevVADVGxmZOPAIN4AaABAg,Why learning how to torrent is beginning,0,2024-04-09T17:02:22Z
UgzETcdX5_iFoXxhYw14AaABAg,My gawd. How much tv do you watch in a month?,0,2024-04-09T16:26:29Z
Ugyt3chLxLoE2DkGtp54AaABAg,"With the many options of streaming services today, I don't play to use any of them for a long time. I plan only to subscribe when they have good series or movies released and after watching them, I will probably not continue subscribing the next month. Right now, I am only waiting for Stranger Things 5 and Dune 2 :D",0,2024-04-09T15:02:46Z
UgxM8Zpg9ibXspjeWb94AaABAg,"My 4k Netflix Plan doesn't have any 4k content that's playable, in India.",0,2024-04-09T14:57:13Z
UgzDkCv5NGhv8KjSrxZ4AaABAg,"my permanent subscriptions are Netflix and Playstion Plus, everything else I pirate on the high seas.",0,2024-04-09T14:48:40Z
