comment_id,comment_text,like_count,published_at
UgyrwwAp-gEWPbGEEg14AaABAg,That felt like and unfinished video. Definitely would like to see more on this topic.,0,2024-04-06T19:59:39Z
UgxqieNBbC0Tb-YySQx4AaABAg,"This video especially the ending was one of the most first world problem, white millennialist thing I’ve ever seen lol",0,2024-04-06T19:44:00Z
UgxBvHwSiNyxwmNxp5x4AaABAg,"4:25 ""Well if you're like me and have crafted your personality around filmmaking, movies, and tv, then you might be subscribed to a bunch of streaming services indefinitely. This isn't cheap but it's the kind of thing you might be willing to INVEST in."" Oh, honey.",0,2024-04-06T19:38:01Z
UgxDJ6JhSt6Q0RU-ZmZ4AaABAg,"If a company wants you pay and shows ads, then piracy is a must.",0,2024-04-06T19:29:05Z
Ugz74ELCZEo7sNRSpbZ4AaABAg,Why can’t someone like Google come up with a platform for television which offers a bundled service?,0,2024-04-06T19:25:54Z
Ugz5goK7Hsnt5Z0BwKx4AaABAg,"It would be good to look down to the root of all this, which falls back on consumerism. Everything is changing to subscription-based service, which, in the long run, has us spending more money than we traditionally would.",0,2024-04-06T19:21:04Z
UgwGaf1n-36QMMAY8b94AaABAg,Been a lifelong  serial chuner,0,2024-04-06T19:01:35Z
UgykQ2ahtKXwal2XAHx4AaABAg,☠🏴‍☠,0,2024-04-06T18:58:15Z
UgzYtFEk-Ji2ib6Nme54AaABAg,Greed.,0,2024-04-06T18:57:11Z
UgxFuNY_NWdR4HHjnpN4AaABAg,3:06  why is this so laggy?,0,2024-04-06T18:33:08Z
Ugx4iTKGBvR32vK8NSN4AaABAg,"The only subscriptions I pay for are YouTube premium (to get rid of ads), Dimension 20 and Nebula. There's plenty of content there to keep me entertained and educated.",0,2024-04-06T18:29:40Z
UgxlRnMUIS7-G-pJk5B4AaABAg,"Why are the services not allowing users to pay for a show or a movie just like renting? Then if you watch more than a certain threshold it's cheaper to subscribe to the service monthly, but if you only watch few shows or movies then you can pay per view instead, making it cheaper (and easier)?",0,2024-04-06T18:25:46Z
UgxLLqoO1WdGGJxesiR4AaABAg,"Glad to see ad-supported subscriptions still in the mix. Without ads so much of the internet and media libraries feels deserted. That’s just my opinion anyway. Also, I’m not convinced piracy is the answer either like some commenters suggested. Don’t y’all have to worry about anti-virus software, runtime for that, identity theft services, and additional layers of network security when allowing those streams through your door? I’d also hate to buy an overpowered desktop just to run a VM for the purpose of pirating safely. It all sounds more complicated.",0,2024-04-06T18:25:04Z
UgyXRoR93_s1yCMn-il4AaABAg,I wonder what the solution is... 🦜🏴‍☠️,0,2024-04-06T18:06:27Z
Ugyfo5KPoPeJlLwn_cR4AaABAg,This is why I use Plex hosted on a NAS at home,0,2024-04-06T18:00:10Z
Ugx6vSmGGa8V17PcZWB4AaABAg,lol just entirely tip toe around the huge elephant in the room. Very bizarre video. What would lead you to cut-out the topic of piracy?,0,2024-04-06T17:58:27Z
UgwoFNGNRe9qW_Z8p-x4AaABAg,for me its always nerflix and one other streaming service. Netflix is still best value for money,0,2024-04-06T17:54:05Z
UgyTuSA69qV4pbybRZp4AaABAg,I'm so glad I'm not hooked on anything in particular.. I have 0 subscriptions,0,2024-04-06T17:49:55Z
UgwGtM7dcctoR1EVA8F4AaABAg,Arrrrr!,0,2024-04-06T17:39:29Z
Ugx592Z5Or-7RWg7kh54AaABAg,Pirate movies and stash them on your old hard drives,0,2024-04-06T17:36:33Z
UgxT3yB1tlmMWVi0k4J4AaABAg,"I have started rotating through streaming services.  Until recently, I had always kept Netflix.  Then again, I used their DVD service to watch movies that were streaming only on other services.  I realized that I have gone a few weeks without using it, so Netflix will soon be in the rotation.  I actually spend much more time watching YouTube, so it has become the one service for which I will pay extra to eliminate ads.",0,2024-04-06T17:31:12Z
Ugx6oAipBP2Xig78dSd4AaABAg,"If companies want to squeeze more bucks from me every month, and are so adamant in me paying them to access their content, I can certainly learn to live without media. Heck I haven't had a subscription for over a decade and don't even bother pirating things. At least Big Media has been in its worst point in history, so I'm not missing much.",0,2024-04-06T17:27:50Z
Ugx06JRBC0PB0rkoLQt4AaABAg,Yeah I’m Disney+ & Max.,0,2024-04-06T17:27:29Z
UgwOINRt25ZRr6XMiLV4AaABAg,So either they all have bad business models or their business models were always to increase prices when they felt they''d hooked enough people. Cool.,0,2024-04-06T17:14:42Z
UgxGRZVc9aokuF3bQHx4AaABAg,Just pirated it !!,1,2024-04-06T17:14:08Z
Ugwr651xlVhoNrGLkiJ4AaABAg,"i cancelled all these services. Started reading books again. It is life changing. OK i watch youtube, you go tme, but you must self regulate the content you watch else the matrix has you. What you watch matters, just as what you eat matters.",0,2024-04-06T17:12:07Z
UgwPitPDYtV2wmb5psZ4AaABAg,Sorry i use torrent,2,2024-04-06T17:04:52Z
Ugx6VcZ4SFgk7W1dKOZ4AaABAg,"My streaming ""diet"" is simply just fasting. No TV since 2007 and very happy I took that decision.",0,2024-04-06T17:01:29Z
Ugxn_SCQ5jJMqHL6sWN4AaABAg,At least I can't think of a brand new way out of it in my head. Good luck economics experts!,0,2024-04-06T16:57:02Z
UgwZh6nE80auhQSZH114AaABAg,i didn't realise people actually pay money to watch tv..,0,2024-04-06T16:56:29Z
UgwBXj-hfVMSkGrc7R14AaABAg,"Unfortunately this is kind of a no solution problem, ther are only two ways to make profit, either attracting more subscribers by making high quality stuff, or advertising. However the population has a eventual upper limit and the advertisment revenue is limited. The only way that both companies and consumers can do is passively accept the float of the market economy.",0,2024-04-06T16:55:33Z
UgyeU9xALisw4xsmx6t4AaABAg,The love their advertisers but advertisers won’t come without mass subscribers. So it’s a chicken and egg problem.,0,2024-04-06T16:48:20Z
Ugx1PHQVQ4eT4SqcgOR4AaABAg,"I can't speak for everyone and/or every country, BUT

When I first got Netflix, a huge part of their advertising strategy was around sharing password. Official material from them would say ""sharing is caring"", as would their terms and conditions. I signed for the 4 screens and 4k plan, and never changed. As far as I am concerned, I can still share my password. They can't change a contract after the fact - not here in Brazil.

If they are so worried about it, how about sell plans with a lower number of screens? With sharing password a thing of the past, how many people would have the need to use 4 screens at the same time? Make a 2 screens/4k plan, sell it for less and forbid password sharing on it.

I'm paying to use 4 screens, I'm going to use 4 screens.",0,2024-04-06T16:34:40Z
UgyIF4N6UJklel-ZGp94AaABAg,This video reminded me to cancel Netflix for this month,0,2024-04-06T16:32:29Z
UgzbPGAkeiP5kWxkviF4AaABAg,And that is why PirateBay will always be around the corner! :),0,2024-04-06T16:26:43Z
UgyJFedrVGbiYsnfPiJ4AaABAg,Rent from your library.,0,2024-04-06T16:11:27Z
UgwsuWyHtNdwpTgTBud4AaABAg,or use VPN to download lol,0,2024-04-06T16:06:30Z
Ugw37T0kkSE8NxZPAn54AaABAg,We can expect huge M&A deals in the coming years,0,2024-04-06T15:51:53Z
UgwhFs_HFa2b8FExuRB4AaABAg,🏴☠️,0,2024-04-06T15:37:18Z
UgwZ6hQxFmmf9RJsG-J4AaABAg,Use stremio and be happy with piracy,0,2024-04-06T15:33:02Z
UgzE8JQsMk7q9cmLms14AaABAg,"bro just pirate your movies and shows, it's free",0,2024-04-06T15:32:46Z
UgyY-tFAgT6A1kWZu3t4AaABAg,Yarr matey ☠️,0,2024-04-06T15:26:34Z
UgxArWNsAH0VWKcDYHt4AaABAg,yohoho I guess,0,2024-04-06T15:21:33Z
UgwATsnSCK033iBgNgh4AaABAg,buy DVDs of movies and dont pay to watch online ever again,0,2024-04-06T15:16:30Z
UgxVd5vx3k4bOJZTaHl4AaABAg,watching the host shave his beard off would have been more interesting,0,2024-04-06T15:13:34Z
UgyQaJG291Xa9lCQFmR4AaABAg,"Meanwhile, you go to one pirate site and you find any show and movie you'd want to watch INCLUDING many foreign tv shows and movies that American streamig services don't offer",0,2024-04-06T15:06:39Z
Ugwjyu6bvhnxBRCdjdB4AaABAg,Should be titled: Why the era of pirating will return,0,2024-04-06T15:03:26Z
Ugy2ff8x7-pRMSLZ2N54AaABAg,Back to piracy baby,1,2024-04-06T14:58:55Z
UgyhSoE2HTE9gADVtPZ4AaABAg,Its time for piracy to be back!,0,2024-04-06T14:53:47Z
Ugy0FlrmxL_yNb_8NR94AaABAg,This is why you go pirating :),0,2024-04-06T14:48:17Z
Ugylv8dT4iK6P3GUW5p4AaABAg,"YAR HAR FIDDLE DEE DEE
BEING A PIRATE IS ALRIGHT WITH ME
DO WHAT YOU WANT CAUSE A PIRATE IS FREE
YOU ARE A PIRATE

Seriously Vox. Not one mention of pirating? You are completely ignoring the two main reasons why people moved away from cable: cost and ads. Now that cost is rising and ads are becoming forced upon people those savvy enough to pirate are, indeed, pirating. You don't even need to download the material. Heck you can watch the newest episode of Invincible the day after it's released, in excellent quality, with no ads, and with no downloading.

People aren't going to become ""serial churners"". They are going to become pirates. And they'll be right to do so.",0,2024-04-06T14:46:45Z
UgxzCUczmeqeDAuGZkd4AaABAg,"Just seems like the thing to do is go on a month-by-month basis with whatever services you prefer. In April go Netflix, in May go Disney. If it's June, whatever else. $12 or $15 a month, or whatever it would be. No one's forcing subscribers to pay for a full year, month after month.",0,2024-04-06T14:38:03Z
Ugwe6q4kmEMbGJd-OPV4AaABAg,BDS babes,0,2024-04-06T14:37:56Z
UgzziCL6mhl67VnNuW14AaABAg,piratebay is your best friend,0,2024-04-06T14:18:45Z
Ugy_NYZZK1B6ULCYv5h4AaABAg,🏴‍☠️🏴‍☠️🏴‍☠️🏴‍☠️,1,2024-04-06T14:17:33Z
UgwowWjSu7DzgVOOCON4AaABAg,"Of course we can do better as consumers. Yo-ho Yo-ho! Set sails, to the High seas!",0,2024-04-06T14:13:52Z
UgxyJI9Bl_zmZRFAMVl4AaABAg,Iptv is like 6 euro/m and have all streaming. Take that losers.,1,2024-04-06T14:05:06Z
UgwU4S6QFE4H02ygq1d4AaABAg,🏴‍☠️,0,2024-04-06T13:58:26Z
UgziZuqyRAkWSoZpsDd4AaABAg,"There is room in the market for truly personalized content, like: pay *only* for what you watch. Nobody watches everything on Netflix, Hulu or others. Maybe 25 cents per episode or something like that.",1,2024-04-06T13:56:50Z
Ugy4cYvrx8Hr1iSCvtN4AaABAg,Did the hub price went up as well?,0,2024-04-06T13:53:46Z
UgyNCDyjBVtMHaWd7_Z4AaABAg,"I feel like the main problem is that you have to subsidize a lot of content you don’t need or want. With cable, you could pick your selection of channels, but now you also get Netflix’s ridiculous reality shows and gazillion of lookalike TV shows with repeated storylines. Maybe they should make less content and prioritize high-quality stuff? Here in Europe I can get a cinema subscription for $20 and gladly pay for it, as well as occasional cinema tickets when something is not screened with my provider, but I am sailing the high seas for TV shows at this point (I actually pay about $10 to a service provider for that because I can stream all high-quality TV shows with them with a convenient interface, so that money would have gone to Netflix or HBO if they offered a wider range of things to watch).",66,2024-04-06T13:46:56Z
Ugz9yKf456MLPidkshh4AaABAg,"A reason why Netflix price may go up again is because there is a real chance that they may end up hosting shows that used to be on Paramount Plus, MAX, and possibly even Peacock, as the major media companies wind down their streaming efforts. Disney will likely hold out because of the likely spinoff of ESPN into its own separate streaming service.",1,2024-04-06T13:19:33Z
UgxeMAIw7-FahfQ0fHl4AaABAg,"All i have to say is, and i quote. ""Yar Har Me Hearty"".",0,2024-04-06T13:13:40Z
UgyWkCCgp4ZCx9tCpGl4AaABAg,"As usual, a very shallow video with high level production. 

Not mentioning piracy is a dead giveaway the video isnt genuine and the writers don't have a free hand. The fact that most top comments talk about piracy reflects that.",2,2024-04-06T13:03:16Z
UgzIrfuSTlVNEwmjHRp4AaABAg,laughs in sflix,0,2024-04-06T12:58:36Z
UgwDpkSsEo0dTRKHqlp4AaABAg,"While i do think pirating and serial churning are valid methods, I'm sad to point out that not every one is going to be that savvy. I can do some of this, but my parents (who are in their 60s) have lots of difficulties. My sister and I have been helping but it's getting to the point that we all have to rethink about streaming. 
Oddly, while it is becoming an old format, DVD's can still be valid. Especially when you remember that you do own a DVD, while in a streaming service you don't. It's not great but when bills are piling up and managing in this ""wonderful"" economy, you have to consider what you do own and what you don't. 😕",0,2024-04-06T12:46:34Z
UgwoRM0J0sAL6wJU9UZ4AaABAg,"As someone with zero monthly subscriptions, it's actually quite easy to live this way happily and comfortably. There's more content uploaded to YouTube every single minute, than you could watch in three weeks (500 hours of content uploaded per minute)!",1,2024-04-06T12:42:06Z
Ugybrh_VADN8WN-WMUZ4AaABAg,The same thing will happen to the food delivery services aswell in few years,0,2024-04-06T12:34:30Z
Ugw792M_ltDSh3YooFR4AaABAg,They got nothiung I want to spend time on.,1,2024-04-06T12:33:03Z
Ugy8kLoCvjiOhGRwYgR4AaABAg,"When people ask me ""where can I watch this TV show?"", I just say ""I'm Russian"" and give them The Look.
And a rutracker link.",2,2024-04-06T12:23:19Z
UgzB4nEBcwKqOptaC254AaABAg,There are better things to do in the world than stream mindless shows/movies,1,2024-04-06T12:03:59Z
UgzKRb64c-lNkiQD1gt4AaABAg,On this week's episode of Ruined by Capitalism...,0,2024-04-06T11:59:39Z
UgwLloaxuonJkpPT2sJ4AaABAg,"The old era of cheap streaming might be over, but the new era of free generative streaming is about to kick off. Bye-bye Hollywood.",0,2024-04-06T11:59:31Z
Ugx2zPVUpiCJulNnild4AaABAg,I’m going back to sweet torrent now,0,2024-04-06T11:54:06Z
Ugz6wicVVwsXI9Nyg2l4AaABAg,YouTube and Dodgy firestick FTW,0,2024-04-06T11:48:23Z
Ugx2-ZMxWbvQ_f2o3Dl4AaABAg,"If streaming gets anymore expensive, I man switch back to cable.",0,2024-04-06T11:42:24Z
UgwFHRrym-gEu3LEerN4AaABAg,the amount of money i saved from being a pirate is insurmountable,0,2024-04-06T11:40:57Z
UgyIt6dFTRIjFo_ELUh4AaABAg,🏴‍☠🏴‍☠🏴‍☠,0,2024-04-06T11:34:46Z
UgxizYH-F7iJfK9n4mh4AaABAg,Corporations bait-and-switched people off piracy. But torrent still exist. I would never pay money to get a worse product: low bitrate and web-based presentation.,0,2024-04-06T11:32:02Z
Ugzo8uhHWtNacnInmr94AaABAg,Long story short: They realised they were losing money and increased prices.,0,2024-04-06T11:31:39Z
UgzvQaJnv7XTAICN-YV4AaABAg,"There must be an all encompassing 3rd party platform something like Google TV which will provide a one time access to a film or series, at a good price, without having to subscribe to the platform who owns this content .For example I watched a movie on Youtube tv, paid for the movie, but I think that there is a share profit scheme with Netflix or Paramount or sth like this. But yes, this multiplatform subscription cost is a problem. Same with sports channels in Europe at least like Sky Sports",0,2024-04-06T11:30:46Z
UgzBU77L_wxlhaJt8XB4AaABAg,"If buying isn't owning, piracy isn't theft.",0,2024-04-06T11:27:26Z
Ugyla6wdWOw5WgIHpyJ4AaABAg,There needs to be a third party company that charges $1 a month to help manage all your subscriptions so that you can easily Churn. I'd definielty churn more if it was easier. Would also be good if that service could have a master 'watch list' so that you can see exactly which streaming platform has the most content you currently want to watch.,0,2024-04-06T11:26:11Z
UgxvkprLG-Dwpf2l0ut4AaABAg,WOW.  This was really a genuine 100% waste of time.   Watching a blank screen would have offered more information or entertainment.,1,2024-04-06T11:25:01Z
UgwUzLZMT9RUeEjaOdJ4AaABAg,"Make woke films, lose subscribers = lose money.
Charge people who watch woke more = punish them by charging them more.",0,2024-04-06T11:24:16Z
UgwcHbGwzPqry33ejn54AaABAg,Netflix should change it name to Gayflix. Still waiting to watch a series where I don't have to skip scenes.,1,2024-04-06T11:22:16Z
UgzHFh7phsZbuqR7Afh4AaABAg,piracy has become a profitable venture again. not that we need to feel sorry for these behemoths.,0,2024-04-06T11:20:57Z
Ugx0WARvHCTRbMH8yAx4AaABAg,How ignorant does someone have to be to make a video about the economics of streaming and not mention piracy even once?,3,2024-04-06T11:07:15Z
Ugx6krfJXQRK0dHbil94AaABAg,I think if your entire family consumes content then it's definitely worth paying for these services.,1,2024-04-06T11:04:56Z
UgxNwHKchShAMuhAb9Z4AaABAg,Sailing is the key ,0,2024-04-06T11:03:19Z
UgwbG2yLkX96WGKRl5N4AaABAg,These companies are gonna end up doing the same thing cable companies do and lock you in a contract and have you pay a penalty if you leave early. Sure a bunch of people will resist for a few months but theyll cave as humans often do when they live comfortably and need entertainment to ward off the existential dread of their fading mortal existence.,0,2024-04-06T10:55:52Z
UgyG_cYbZBWqLboWnHB4AaABAg,"The idea that netflix thinks it has/can have control over streaming is funny. Free sites existed long before them, and will continue to exist long after its gone",1,2024-04-06T10:54:32Z
UgxaHmPL6KFTwvTrSRB4AaABAg,"This is another problem with companies being publicly traded in the stock market. Stock market shouldnt be a thing, you dont see Valve constantly playing the game of layoffs and increasing prices in order to increase the illusion of constant growth",61,2024-04-06T10:52:29Z
UgzJ5qrPf_yaQwRFAp54AaABAg,"Time to crank on obs...for no reason. As far as downloads go, VPN companies do not want to fight any legal battles. They WILL hand over your info when asked. Dont go for anything new.",1,2024-04-06T10:48:51Z
UgzjnUNETA4eHjTNvJd4AaABAg,Why didn't you cover torrenting?,1,2024-04-06T10:47:09Z
UgzhiSjUWELmeFsoA0B4AaABAg,Its way cheaper in India as compared to US…,0,2024-04-06T10:47:03Z
UgyL5YCwDkj6MurCtiF4AaABAg,back to the seas we go fellow pirates,0,2024-04-06T10:44:35Z
UgzNLUxF95utkczLBwB4AaABAg,piracy...,0,2024-04-06T10:39:07Z
Ugxl9OoXqJFbJMlEtoR4AaABAg,Thats it? I thought the outro was a joke. Bro barely said anything.,1,2024-04-06T10:36:24Z
UgxVWEAAynI2HPI8ps94AaABAg,Laughing because the pay for ads model isn't working in Australia. Here we expect an ad-supported service to be free.,0,2024-04-06T10:27:25Z
UgzP4SGBhH-F32tTT4V4AaABAg,watch youtube for free or play videogames,0,2024-04-06T10:25:56Z
Ugz9Wv444-Hb9oUu5y54AaABAg,Churning... Millennials have invented movie rentals,0,2024-04-06T10:25:46Z
Ugz-nIaHSxdZzk2wOCF4AaABAg,"Sky (a satlight TV and streaming provider in the UK), is bundling streaming services now.  Which seems quite a clever way of doing it.  As Sky get subscribers and then you can pick and choose the streaming services you want and get a discount through Sky all provided through the Sky box.  Why take on the streaming services when you can work with them to upsell.",0,2024-04-06T10:16:57Z
Ugxy_RTV7nP6ONgzM3F4AaABAg,Just jumping in to say Dropout is like $6/month. It's basically all I watch now.,0,2024-04-06T10:13:37Z
Ugx-IkiMNojljmG9YOF4AaABAg,Piracy needs to be brought up in this conversation. Calling subscriptions to these services with ever increasing prices “investments” is absurd (unless your job requires them.) kinda useless video that was all common knowledge and seemingly purposefully ignorant or avoidant of piracy’s impact and importance to the consumer.,0,2024-04-06T10:02:42Z
UgyXXrvaMKJG4TbPlax4AaABAg,"I get value from crunchyroll and some minimal value from netflix, although my wife likes netflix, the rest has no real value to me. The outcome is simple, i pay for crunchroll and netflix and the rest i forget about.",0,2024-04-06T10:01:48Z
UgzHjO4a124Bq_NDTFZ4AaABAg,4:30 no you just get paid well and dont care,0,2024-04-06T09:57:54Z
UgxP9Uju9V_kFjDJM154AaABAg,Torrent is the key to all happiness :p,0,2024-04-06T09:57:04Z
Ugz4qfRqo8XmMfviict4AaABAg,Serial churning is a worse experience than piracy. You have to plan ahead check what you can watch where and which season of a show is on which service and you have to remember to cancel and resubscribe to some other service. Why go through all that hassle when you can just download it or open a website and watch it there?,0,2024-04-06T09:49:55Z
UgzIQ9CZqhZw3EnjFHx4AaABAg,That’s why people go for piracy. Who wants to pay so much?,0,2024-04-06T09:38:44Z
UgxajXC7OoJMahoszFp4AaABAg,They either merge some of these... or deal with even more churning in future,0,2024-04-06T09:33:04Z
UgzR-KoK1XRgS9X8bAh4AaABAg,Take the battery out or unplug the devices.,0,2024-04-06T09:32:22Z
UgyjspC4DzNproH5r9d4AaABAg,just pirate it. I dont pay for multi billion dolar company,0,2024-04-06T09:24:46Z
UgzaEZHttQmdp7m5Oft4AaABAg,"Yup, it is nice to have a service buuuut at a point everyone who wants a membership already has it. 
It reminds me of membership drives at stores. You know the stores where they hound workers to try to push creditcards/store cards and other memberships. 
It doesn't works at a point.",0,2024-04-06T09:20:12Z
UgxlUAlaIp2Z-aglyG94AaABAg,"D+ Just went up from $10 to $19 where I live. Yeah, I dont even use it anymore and if I want to I can just buy a month.",0,2024-04-06T09:09:58Z
UgxFcgwsMEKXoe09KUB4AaABAg,Or how about the strategy of just only watching things you can buy and own.,0,2024-04-06T09:03:10Z
UgzoUjA8WY-y1Q4VaE14AaABAg,Netflix is only 149INR  starting in India that's less than 2$ a month. Extremely cheap,0,2024-04-06T08:59:42Z
UgwoMaoYJF8IcfTaEnh4AaABAg,It looks like I will start reading novels again.,51,2024-04-06T08:59:04Z
UgzyRtQ3To_j412gpBt4AaABAg,Or just read a book. Maybe you then can make more interesting YouTube videos too. 😎,1,2024-04-06T08:57:20Z
UgxKhnkPlb_GPPde1kR4AaABAg,Surprised libraries are no where in here. Maybe there's a disconnect between what's normal for folks making a certain amount in cities versus folks in more rural areas but myself and a lot of people I know are switching to getting more and more of their media from libraries. Both in the form of DVDs and from their streaming services like Hoopla and Kanopy. I know a lot of people talk about piracy but a large swathe of people will just never be comfortable with it or have the technical know how to do it. Libraries are the most accessible alternative.,14,2024-04-06T08:54:05Z
Ugwc59TMnJVwRRUYd5Z4AaABAg,I love how Vox didn't even touch on pirating. Absolute garbage journalism.,0,2024-04-06T08:49:18Z
UgwcwvKPuxdvLfxI_414AaABAg,"""So many great things to watch"" ...every streaming service combined won't have as much content you actually want to watch as a video store had in 2004",0,2024-04-06T08:47:10Z
UgxE6e1sm1SwdsLAAmx4AaABAg,"I don't get what he's talking about, I watch everything for free🏴‍☠️",1,2024-04-06T08:47:07Z
UgxARTkfvGhfLp4400h4AaABAg,"Profit, greed and the pressure from Wall Street bring back better returns. That's the reason for all the greed in the US lol. Private Equity and Hedgefunds just want to get richer at the expense of everything and everybody. We saw it in 2008 and we'll see it soon enough (whether it's next year or 2050).

Edit: I think a better way to say it is, the deteriorating quality of the life of lower-to-mid class has led to an explosion of greed. Companies want to clinch hard to their profits no matter the state of the economy and the American people. Blame gov lobbying and how it has shaped big business since Citizen's United VS FEC. 

This is just an intuitive guess, but I think the FEC's embarrassing L made America richer. Without big-business lobbying, the US would've been economically closer to Europe. I mean, 3 trillion dollars, and they still pay less taxes than a janitor.",0,2024-04-06T08:29:01Z
UgyMtsbclU9cGlGG4_J4AaABAg,I have literally dropped all subscriptions and stopped watching things altogether like I did with cable back in 2006. A streaming service is something nice to have so as soon as it gets too expensive or they introduce ads they get dropped for me and I feel like more people should do the same instead of treating these services as a must have no matter how much anti consumer junk gets pushed with it.,1,2024-04-06T08:28:12Z
UgxwzEwCg0uzCxmmIk94AaABAg,Piracy 👍,0,2024-04-06T08:19:33Z
UgwM1BiS6hCtQosa6rx4AaABAg,Popcorn time go brrrrrrrrrrrr,0,2024-04-06T08:16:12Z
Ugx-X4kfcKheECbSLbR4AaABAg,Need more missing chapter episodes!!! I got hooked on Vox cause of them!!,0,2024-04-06T08:07:27Z
Ugya5d0aMI3djJtdIzx4AaABAg,The high seas are open to everyone.,0,2024-04-06T08:06:27Z
UgxuWWbq7MTnh4V_bkd4AaABAg,"like the great pirates once says
“You want my treasure? You can have it! I left everything I gathered together in one place, now you just have to find it!” 

Gol D Roger

thus began, the golden age of pirates",0,2024-04-06T08:03:31Z
Ugx2uNUDyGVBk_e788J4AaABAg,"Does someone know the name of the movie / series next to ""The Gentlemen"" at 1:21?",0,2024-04-06T07:41:15Z
UgwHprH4gTmWqmB2tiN4AaABAg,Just get Kodi.,0,2024-04-06T07:40:08Z
UgzaR-NFBFkarR_Usbh4AaABAg,"Cancel them all.

They won't care unless you cancel.",1,2024-04-06T07:32:57Z
UgyfmcaJ1Qkh9Wzor7J4AaABAg,Just go pirate,0,2024-04-06T07:24:15Z
UgyqAzLQAGwuWozSdqt4AaABAg,"Yt/s and Pirateba/y, my beloved pals",0,2024-04-06T07:23:09Z
Ugybh244WAGPxPjgJD14AaABAg,The only streaming service I have is Amazon Prime and that's only because I order a lot from Amazon and  Amazon Prime also comes with unlimited free 2-day shipping. 😅,1,2024-04-06T07:22:01Z
UgwQcw9Dv0hCe4G4wKp4AaABAg,Libraries are free guys,1,2024-04-06T07:18:00Z
