comment_id,comment_text,like_count,published_at
UgwgO3399Jw-rBi2XSJ4AaABAg,"we need to stop calling  ‘paying for things’ ‘investing’. unless your buying netflix stock, you’re not investing in anything",0,2024-04-05T18:22:24Z
Ugy34KQ0_eR5OjJO4vl4AaABAg,"for me, paying and getting adverts is a no no. using the US example of cable tv isn’t really a good comparison; it simply illustrates how long people have been suckers for.",0,2024-04-05T18:20:12Z
UgwqFFQ6d-nBUm4Wzhx4AaABAg,"At this point, I've started reading again.",1,2024-04-05T18:20:09Z
UgxmULm3OfMkaTLAN214AaABAg,"I gotta say.. I was pretty shocked at how few ads actually run on netflix's basic plan. I dropped down from standard to basic because standard is now almost $20 canadian.. but the basic is $6 with ads. In a 1 hour long video, I might get only 2 ads, each usually 15 to 30 seconds (not 2 minutes worth of ads like television). Also, many times I don't even get a single ad for a video. I was genuinely shocked, I expected 2 to 5 minutes worth of ads per video.. not 30 seconds of ads per video, tops. The basic plan kept me from outright cancelling my netflix subscription as I was not going to pay nearly $20 a month for standard service.. but $6 feels very reasonable, especially considering how short and few the ads are.... we'll see if that lasts though (probably not).",3,2024-04-05T18:18:57Z
Ugwaxk4QQeTJoqsqzol4AaABAg,This is definitely one expense we can all live without.,1,2024-04-05T18:17:37Z
Ugy0ExHTx-Cd96EPWpV4AaABAg,if only there was another way 👀,2,2024-04-05T18:15:19Z
Ugw1NaXwT5r5PiaSfzR4AaABAg,I really hope streaming executives *read these comments* and come to the realization that: a lot of people are just going to start pirating their content.,1,2024-04-05T18:14:33Z
Ugzx92nGaEi3L1E7qIJ4AaABAg,"The same thing will happen to ride, groceries and food deliveries... You guys just watch.",0,2024-04-05T18:14:08Z
Ugz88RXjf1N7XuOOFHZ4AaABAg,paid services also censor so you get less too.,0,2024-04-05T18:12:27Z
Ugyg_aunUYI6FFK0MPF4AaABAg,"What shall we do with the drunken sailor, what shall we do with the drunken sailor... 🏴‍☠🏴‍☠🏴‍☠


For anyone that knows my email address, I'm joking


(I'm really not joking)",0,2024-04-05T18:10:02Z
UgxTpUfXluQSe6Qr5jF4AaABAg,welp time to go to the cinema like I always did i guess.,0,2024-04-05T18:10:00Z
UgxSXUe2pb57ILFlwkp4AaABAg,I used to torrent TV shows and movies as a broke teenager... then I became an adult and got a job and started to pay for streaming. Looks like I'll be going back to torrenting thanks to Netflix and Amazon!,1,2024-04-05T18:09:21Z
UgxF0-YqIRH3OSOOY1R4AaABAg,Streaming diet...................,0,2024-04-05T18:08:58Z
UgzMqfME9S7wj3UQefB4AaABAg,"It'll always be better and cheaper than cable, no matter what",0,2024-04-05T18:07:34Z
UgxXAAtCkyc8M1_ffWd4AaABAg,qBittorent has always been free,0,2024-04-05T18:06:25Z
UgwMQQ5FUx3pZPDzIr54AaABAg,noice,0,2024-04-05T18:04:07Z
UgxmPbxuNmOzaDaPBU54AaABAg,VPN,0,2024-04-05T18:02:01Z
UgzQ7Kzi2XAyx56pRtp4AaABAg,Arrr.... the resolution to this here conundrum be a clear one!!!,1,2024-04-05T18:01:34Z
UgxItHLZSSIVuQi2SCB4AaABAg,Just stick with what's free and don't get caught:p,0,2024-04-05T17:59:39Z
Ugy6SQ8Mq_7eymhf7uZ4AaABAg,"How do I make my streaming diet work? 

Canceled subscriptions and got a library card. I check out so many series and DVDs and use Kanopy and Hoopla. I haven't seen an ad in months.",0,2024-04-05T17:59:25Z
Ugz9lHyE8jWH_tS3qOx4AaABAg,"Streaming,  and every other tech breakthrough from the last ~15years, was a Pandora's box that we now have to live with unfortunately. Well unless everyone would just cancel their subscriptions to send these Tech companies a message",3,2024-04-05T17:59:18Z
UgxWthpMsvQZsuZOAat4AaABAg,Just pirate bro,1,2024-04-05T17:57:08Z
UgzdpgcOubSuAqmmtIR4AaABAg,I'm only subscribed to YouTube Premium. None of the other services.,0,2024-04-05T17:57:01Z
UgyM35non6G9VC6dtgB4AaABAg,PureFlix is actually a great service now. So that's the only one that I keep. I randomly purchase the other ones from time to time.,0,2024-04-05T17:56:21Z
Ugw1Q_NhYSDXG3olq5h4AaABAg,"There should be a radarr (wink) to let people know where their favorite movies are. What about a, hear me out, a sonarr (wink wink) that let you know about your must watch tv shows.",0,2024-04-05T17:55:34Z
UgzdjZUr5W90df1V5MF4AaABAg,yarrrrrrrrrrrrr,0,2024-04-05T17:54:48Z
Ugz5VMVkZvALASkTW5p4AaABAg,torrent,0,2024-04-05T17:54:42Z
UgzK4b2geLOlJnNqwdh4AaABAg,soap 2 day all the way,0,2024-04-05T17:54:39Z
Ugyb0hd_YXhd6ZkPxiV4AaABAg,why did you ignore the biggest elephant in the room? Piracy,68,2024-04-05T17:52:59Z
UgwWLwWngufI2LLOD8h4AaABAg,Time to brush the dust off my black hat,0,2024-04-05T17:52:27Z
Ugzeir23jSehzwrNPzB4AaABAg,I just purchase the show I want to watch.,0,2024-04-05T17:49:42Z
Ugyn_Mhy7ZoXRJBnWI54AaABAg,I guess its time to start rebuying CD's again. Many PS4 & PS5 users are doing just that.,1,2024-04-05T17:48:16Z
Ugwk4xoKy5j4dH1pPa14AaABAg,"We sail the high seas once again, argh! 🏴‍☠",1,2024-04-05T17:47:43Z
UgzfKzl0q_U9y2sGcEt4AaABAg,Mugiwara enters the chat: 😁,1,2024-04-05T17:46:45Z
UgxX9_IuT4RmtspVW6R4AaABAg,"Well, there is an alternative and free way to acquire their content 🤷🏾‍♀️",2,2024-04-05T17:42:14Z
UgwnxkZO-KQVyDuMp4R4AaABAg,This is why I read books lol,1,2024-04-05T17:42:14Z
UgxSy9drrRsGI0dSlQN4AaABAg,I pirate everything in BD quality for free before it's even up on streaming and use Jellyfin to run my own service. I've not seen an ad in many years. I have no plans of stopping anytime soon.,0,2024-04-05T17:41:16Z
UgwWKFvTsVKE-Jh9Kwh4AaABAg,"Wait, people have time to watch stuff?",1,2024-04-05T17:39:36Z
Ugz0mZXaGKIHDiSz4IF4AaABAg,And thus a new age of Piracy began.,1,2024-04-05T17:39:22Z
UgwzOqQqDbAYCUonz3x4AaABAg,I have a friend who pays for them all he is called a pirate,0,2024-04-05T17:38:36Z
Ugyh8qqCEnmeDjP1u7N4AaABAg,"My favorite streaming service is Max, so I just pay for it with ads because I don't care about ads and if Max does not have content that I want then at the next month I'll pay for an another one. Most of time I don't pay for streaming services at all.",0,2024-04-05T17:38:32Z
UgzZKqYGHEfRcAF5Vth4AaABAg,"I am a churner for ALL these services. Never have never will subscribe indefinitely.  And I go years between churns, which last only a month.",2,2024-04-05T17:37:34Z
Ugwnpi69iCSVFwauYkt4AaABAg,F**k'em corporations!,0,2024-04-05T17:37:02Z
UgzmHT8jTk8fx3REUil4AaABAg,THANK YOU for giving me and my tribe a name: SERIAL CHURNERS!😂,0,2024-04-05T17:36:36Z
UgzzMszm3IJkC-h2ENF4AaABAg,"TL;DR - Money

This video is a bit late to the story. Seems more like filler for the channel.",0,2024-04-05T17:34:14Z
UgxLLQjdPtJ09R7GJ-14AaABAg,Cut the cord from them all with Plex. It can be QUITE cheap if you know how to read.,0,2024-04-05T17:33:13Z
Ugx0MupSEU_XdTW9MAx4AaABAg,I am using a website that has all movies and all TV series for free. So yeah.,0,2024-04-05T17:33:12Z
UgzCgjFO_TFdrLSjVZ94AaABAg,The weekly planet! Let's GO!,0,2024-04-05T17:33:01Z
UgwLwMQDetDfDRHsneF4AaABAg,I just use moviebox for free and can watch all the shows all the streaming services offer!,0,2024-04-05T17:32:44Z
UgwAyZvOtEbv55OzH-F4AaABAg,I’m a churner!,0,2024-04-05T17:31:50Z
UgyVJXZ2Ha796eo2ugR4AaABAg,Torrent and Piracy Era Again going to rise because of this.,0,2024-04-05T17:29:50Z
UgxnzxSLYXwN7LhjmG54AaABAg,"It isn't over, just pirate",1,2024-04-05T17:29:14Z
Ugz4m1-2VunaNaV2VO14AaABAg,Aren't there some services that bundle subcriptions and let you pay one smaller price?,0,2024-04-05T17:28:24Z
UgzxULaMX2cgSd-iWQF4AaABAg,"The worst part is shows that get cancelled without any ending. The more it keeps happening, the more people wait until all seasons are released before watching. But that makes viewership numbers for potentially good shows to go down, leading to their cancellation.",0,2024-04-05T17:28:23Z
Ugz8f9ffd7oAVbZcfw54AaABAg,AAAARGH 🏴‍☠⛵,0,2024-04-05T17:23:58Z
Ugy-N0UQt0xzZ2Ny4iF4AaABAg,🏴‍☠,0,2024-04-05T17:22:25Z
Ugx9MYsy-PiqU0PhXu94AaABAg,"You're forgetting WHY Netflix lost subscribers for the first time in 2022. They pulled their services out of Russia. Then they pushed on the password sharing issue to follow.

The REAL reason your subscription is increasing is that the DOJ has been working to silently repeal the Paramount Decrees for years. The entertainment industry is losing important anti-trust regulations. We now have a bunch of streaming companies that are vertically integrated, and studios like Disney and Paramount are pushing up Netflix's prices. Netflix has to shell out more in MGs or produce original content to catch up with the libraries of Disney and the like - and even then, it's just an impossible thing to do.

And now that we're moving away from box office numbers, the independent producer is losing their negotiating power. Only the studios know what has been profitable.  Licensing content is hardly an option - they often want to out-right own the content, which not only decreases future profit opportunities but allows the indie producer little opportunity to outright own their libraries. 

I'm shocked none of this was mentioned. There's huge concerns amongst independent producers.",0,2024-04-05T17:22:20Z
UgwCGqo4usy3F1rZ34J4AaABAg,"I was an early adopter to streaming, not only Netflix, but also Prime, AppleTV and others. It was cheap and good content.

But now? Now I just sail the high seas. Its easier, cheaper, faster and all the content is in ONE place. And Im not the only one.

And the fact that this video completely ignores the fact that piracy exists is kinda shocking..",9,2024-04-05T17:22:14Z
UgzwjGr8KfGsefCwUfh4AaABAg,I had no idea some people were actually paying for multiple streaming subscriptions at once. That's nuts,0,2024-04-05T17:21:47Z
UgyXkf-iIu3SDrMKUgJ4AaABAg,"If piracy is more convenient than streaming, then streaming providers did something wrong",31,2024-04-05T17:21:43Z
Ugw-g-bIInGClX9YIiR4AaABAg,This is the first time in 15+ years I've started pirating again.,1,2024-04-05T17:19:30Z
UgwZE_uBjPPW68nbYWp4AaABAg,We need compulsory licensing for TV/movies like we have for music.  Any service should be able to carry any program or movie as long as they pay the Hollywood equivalent of an ASCAP fee.  Maybe give the studio that produced the content a 1 year period where they can make exclusive licensing deals and after that it is compulsory.  Then the streaming platforms become curators instead of exclusive gatekeepers. You could even have a pay per view service that carries *everything* and just passes the licensing fee plus their vig onto you.,0,2024-04-05T17:18:57Z
Ugx93sQxL3dN_EnfnqN4AaABAg,"it's about chooses, but at the same time, you have to be creative",0,2024-04-05T17:18:14Z
UgziTATzT56TEQBGlth4AaABAg,Check out your library system for free movies and audio books.,1,2024-04-05T17:17:20Z
Ugy62fT2XITHeb43rPZ4AaABAg,Me: *laughs in torrent,1,2024-04-05T17:15:12Z
UgzYkF3xiVoWIMSUpEt4AaABAg,I cancelled Netflix and Disney+ mostly because they kept censoring stuff.,4,2024-04-05T17:13:20Z
UgyLz0uWXGGD6dRacTN4AaABAg,"Arrr...

The mindset of this reporter in this video is why streaming services are pillaging your wallet. It's time to fight back.",2,2024-04-05T17:10:02Z
Ugw_ejA2wKpanfb17yR4AaABAg,Not much value in this youtube video.,2,2024-04-05T17:08:00Z
UgxvHs0V46ew0wnspJN4AaABAg,All the pirates let us sail the high seas again . The one piece is real.,1,2024-04-05T17:06:46Z
Ugy5RlvbxqSLDe1cu1d4AaABAg,🏴‍☠,0,2024-04-05T17:03:25Z
UgyLP_TFY0e5I7rb0gh4AaABAg,Just pirate,0,2024-04-05T17:02:51Z
Ugydscn0gw5BxzkEIYR4AaABAg,"But why is the era of cheap streaming actually over? In the old days, we had a much bigger library from Netflix, for less price. That may have been because Netflix was operating at a loss, but suppose a fair cost was double what we paid then. We pay FAR more to get everything on streaming now. Where is that money going? Similarly, Netflix needed to grow until it was profitable, but why did it need to keep growing? I know the answers to these questions, but they're not in the video.",0,2024-04-05T17:02:46Z
UgyWbcXEi2PBk2Qdkup4AaABAg,"I also tried to pay with cash from my wallet. Very difficult, you can’t imagine!",0,2024-04-05T17:02:42Z
Ugx73uZPeNhRAGWyMvZ4AaABAg,"I don't understand Disney+ given Disney's strong brand image and almost 100-years old catalogue of content. ""Pay 5$ to have the entire Disney catalogue as well as a place to view every season of the Simpsons"" is so much more appealing imo than ""Pay 10$ and on top of that catalogue, you also have access to a bunch of original shows and movies that cost a fortune to make but might not be of any interest to you"".",1,2024-04-05T17:01:45Z
UgyenBLNSKNgv2DWgMJ4AaABAg,Buy physical media.,1,2024-04-05T16:59:56Z
UgxB91qdgYTPjRq0OHp4AaABAg,"The era of cheap streaming is over but the era of free streaming is just beginning as people begin to go back to pirating their stuff since the scales of ease to cost are now fluctuating in that direction. And this time, itll be way more popular with more people into it, more things going digital faster, and easier ways to do it",1,2024-04-05T16:59:54Z
UgxglBSnHqGq56w1eQN4AaABAg,"As mentioned in the video: despite current prices, none of the other streaming services are profitable. And Netflix wasn't profitable for many years before. Maybe this is just what it costs to operate a streaming service these days.

The only sustainable thing I can think of is to choose only one or two of the services.",0,2024-04-05T16:59:29Z
Ugynkz1gtTRQ1vleh_l4AaABAg,I'm voluntarily walking the plank😅,1,2024-04-05T16:58:56Z
UgyvrRp6L-Wr0BA6I_h4AaABAg,"It looks as if Vox is making the case that people should continue using streaming services, despite the price hikes, but just jump around from platform to platform. Is this a paid sponsorship? Because it smells like that. 

The internet is ahead of the curb on streaming platforms jerking us around. Vox recommending behavior which continues to rotate around their existence isn't advice, it's marketing.",0,2024-04-05T16:56:35Z
UgwcGmnOjO1DWibidMR4AaABAg,A Russian friend of mine turned me on to some great alternatives. I can watch all content in existence now.,1,2024-04-05T16:54:33Z
UgysnN4p0RzTu2WUUzl4AaABAg,I prefer the Jack Sparrow method,2,2024-04-05T16:52:54Z
UgzYEkx5KDkvVkXoXXV4AaABAg,"People blame capitalism for expensive streaming as if streaming is a right or something. What, do you think under socialism a free streaming platform with all the shows on it would exist? how?",1,2024-04-05T16:52:50Z
UgyYXag3W5STDdlNbMR4AaABAg,🦜🏴‍☠️💀,1,2024-04-05T16:52:28Z
Ugz5pEsu35W36NUKL3h4AaABAg,"I find it so strange that Netflix tried to go down the sharing restriction rabbit hole. There are nations - not the US - that consider your IP address part of your private information, the same as your social / health information / etc. In those nations, you would need a subpoena to get access to this information if the person isn't willing to share it, which they can't be penalized for refusing in this context.",0,2024-04-05T16:50:40Z
UgxtY7PSCtJ5kyMjEuR4AaABAg,Let the pirate era began!🏴‍☠️,8,2024-04-05T16:50:08Z
Ugxm2wrp_RZZTHHaKWd4AaABAg,"I just torrent most everything I watch 🤷🏻‍♂️

The one streaming platforms I’m subscribed to are because they come bundled with other services I use for something else, like Prime or iCloud, and I even have those because I got a student discount.",0,2024-04-05T16:47:55Z
Ugz2mRhtZDkcoFqFztR4AaABAg,Drop it all.  It will be like dropping social media - you won't notice it once it's gone.,2,2024-04-05T16:46:09Z
UgxGXIaWp7bnqGLo15x4AaABAg,Because ALL entertainment media and music is 100% free online to everyone.,0,2024-04-05T16:45:53Z
Ugytel5TH6VDZLNM85Z4AaABAg,Only a loser pays for streaming services. If you you pay for subscriptions youre nothing more than an insect,1,2024-04-05T16:44:22Z
UgxhcrxcloypdLUp9Ut4AaABAg,"Arrrr. I sail the seven seas, tis the pirates life for me!",2,2024-04-05T16:44:06Z
Ugz6izp9Lpus21NhUXN4AaABAg,"Consumers have always wanted a la carte, to pay only for what they watch. Companies have always been about subscriptions. This is the unfortunate disconnect, where people don't want to pay a subscription for so many shows they won't watch. A la carte does exist, I don't think Vudu exists anymore under that name but perhaps Fandango at Home still works the same way.",1,2024-04-05T16:43:16Z
Ugw9TasgGO6h1YtGfx94AaABAg,this is a bit melodramatic,1,2024-04-05T16:42:08Z
UgwjeQgVNaPeoNqy6-l4AaABAg,"I dont, and will not, use any streaming service for content. I´m okay missing series and films. I focus on learning things of interest on yt and practising them when I have time.",0,2024-04-05T16:40:59Z
Ugz-3t6vhsexgUFKrEh4AaABAg,lol,1,2024-04-05T16:39:01Z
UgxkAB8MEtDg57bEylt4AaABAg,"If I watch this video for more than a minute and there's no suggestion that piracy is a solution, I'm leaving",0,2024-04-05T16:38:49Z
UgxS_21CxAhCGIZWu5h4AaABAg,Visit the island of stremio people,0,2024-04-05T16:36:10Z
UgxhpkTluK_szpVn0Op4AaABAg,"Hol' up, you guys are paying? 🏴‍☠",0,2024-04-05T16:34:53Z
UgwrblrTKwdtVmjw4BJ4AaABAg,Reading Books >>>>>>>,2,2024-04-05T16:34:49Z
Ugz8XivhXl7ygxWRUPd4AaABAg,"Churning is very logical. First you ""collect"" things you want to see on THAT platform, this series and this movie and this one too. Next you either subscribe for cheap trial (on new account of on old, some services reset your status after some time, or use promocode) or resubscribe for month, watch all you wanted and abandon ship.
There is really no point into having 3-5 paid services active at same time. You just dont have TIME to watch ALL that stuff.",0,2024-04-05T16:30:06Z
Ugy-WqUP5q2-1n6UgNF4AaABAg,"It's a known process succinctly described as ""enshittification"". Streaming comes along and initially it's a fantastic deal. It's cheap, has no ads, and loads of content. Over time nearly everyone cuts their expensive cable package for it. But then once everyone is hooked, the only way to make more money is stuff that's just going to make it worse. So prices go up, shows get dropped from the services, and ads come in, and we're back where we started.",0,2024-04-05T16:28:48Z
Ugx8xq7mWCVJamUdoUt4AaABAg,DO WHAT YOU WANT BECAUSE A PIRATE IS FREE!!! *YOU ARE A PIRATE!!!!!!*,1,2024-04-05T16:28:01Z
Ugz_5Ro-xe69FaKRvvd4AaABAg,we all need to slow down. We want everyhting all the time for less and less effort. We need to seriously start CONSUMING LESS...less everything.. incluiding series and movies,2,2024-04-05T16:27:18Z
Ugxxeu_4yTWYF3piAgZ4AaABAg,"In all honesty - This is just sad. We're reinventing the wheel of the cable system, and its causing unnecessary inconveniences. I've stopped all subscriptions lately, and rather than feeling missing out on so many things - I actually feel free from the clutches. Sure I haven't seen a good movie lately or a good series, but it makes very little difference (surprisingly good difference). I used to love all these services and what they did for the freedom of creativity of different directors/producers/screenwriters - But there has to be a better way than resorting back to cable-like streaming. The video touches a bit about ""our choice"" to choose what we want to watch, and when we want to watch in our own pace - But it has only created a lot of analysis paralysis, at least for me. 

I can't really figure out if there will be a better way to approach this from a business perspective. Time will tell! :)",1,2024-04-05T16:25:02Z
Ugw0Xw9Y250-rT2Fa-R4AaABAg,"In winter I'll pay for more streaming. But in the spring and summer, nah. I'll be outside, haha",1,2024-04-05T16:24:48Z
UgwvSMJAXuc2yMP9emt4AaABAg,Vudu/Fandango.   I buy my movies and TV.  I only pay for the ones I want. There are never any fillers in my library that I would never watch. They never disappear from the platform while I'm watching them. I can choose which studios or producers I want to support.,0,2024-04-05T16:23:06Z
UgwZMyhhiKYYS55DovB4AaABAg,"Maybe, just maybe, it would've been more cost effective for all if every media company on the planted hadn't gone out to create their own streaming service.",5,2024-04-05T16:22:59Z
Ugzjdput8mwK7NwDvVR4AaABAg,Piracy 📈,0,2024-04-05T16:21:16Z
UgxLTcGMNYaAZReUIEJ4AaABAg,"Last yr I had like 6 streaming apps and it was so overwhelming I was annoyed with them. Right now I have Hulu+Disney, Peacock and Max (black friday deal) and Pluto tv and Tubi (free). Paramount was the worst bc itd always freeze. Apple+ has almost nothin to watch. Im just gonna stay with Hulu, Disney, Pluto and Tubi.",1,2024-04-05T16:19:08Z
Ugye6G4wfB8yk30E6ad4AaABAg,"the answer is cutting all your streaming services and going back to piracy.

a lot of these smaller newer streaming services like peacock and paramount are actively bleeding money to try to get a foothold in the streaming market when they could simply just license out their media to larger streaming platforms for a profit at no cost to themselves.",0,2024-04-05T16:18:34Z
Ugzp8ndioD4oqjzIg354AaABAg,It's journalistically irresponsible to not mention people setting up their own media servers.,0,2024-04-05T16:18:00Z
Ugw6ccKepDRJ7cVhbKh4AaABAg,"Whenever i hear my friends compalin about their subscriptions, all i see is first world problems 🤣🏴‍☠️🤌🏽",1,2024-04-05T16:17:28Z
UgwgmYfH4U64ot0L_i54AaABAg,I have been pillaging since limewire. It’s time to dust off ye ole sea legs mi mateys.,1,2024-04-05T16:16:32Z
UgyXZZIvT0mkxwHG6c14AaABAg,Why the era of torrent has returned,0,2024-04-05T16:16:30Z
UgyLo5_gu-KMD3BKIXh4AaABAg,"I definitely pay for Hulu ad-free, those commercials were killing my sanity.",0,2024-04-05T16:15:56Z
Ugw2F0FlDXBwLzy6yhp4AaABAg,"I was really on the fence having empathy for corporations struggling with debt, losing subscribers and hiking up their price for consumers.
But this video changed my mind.",1,2024-04-05T16:14:21Z
Ugy1S7fhn0xpLIt2sux4AaABAg,I am telling you the golden days of torrents is coming back 😂,1,2024-04-05T16:13:35Z
Ugz0TSDfgz6BZqR1Dv94AaABAg,Me and my friends interchange platforms and accounts according to what type of content we want to watch.,0,2024-04-05T16:13:24Z
UgxnHrYohjitIf6p7ox4AaABAg,Streaming is a scam since the moment they started taking down content to make us pay for additional services to access those products in different platforms,0,2024-04-05T16:13:13Z
UgxRflnB2S5n6ZcE3z54AaABAg,"I watch it all!
P i r a c y😂",1,2024-04-05T16:13:08Z
Ugwgavp29Wl9v-NXVxt4AaABAg,the only streaming service I need is my VPN,1,2024-04-05T16:12:40Z
Ugz6FUfokfMQQj1UNOh4AaABAg,"the problem is not just that, is the subscriptions like amazon prime that you have to pay to have access to only a certain part of the content, you have to pay again to unlock another subset of the content. I WILL NEVER ACCEPT THIS, I'm just paying netflix and wait for all others to go broke and put their content back on netflix, and if their price hike too much I'll cancel it too and hope they start make cheaper productions.",1,2024-04-05T16:12:23Z
Ugx05xNDKHkGtkPaKut4AaABAg,YoHoHo and a bottle of RUM,1,2024-04-05T16:12:10Z
UgwC4NYIoy8M4mBzQBZ4AaABAg,I am not subscribed to any streaming service :),0,2024-04-05T16:10:46Z
UgwCs9-23421Ud8f3SV4AaABAg,Netflix and trend setter in one sentence? Daring,0,2024-04-05T16:10:09Z
Ugy1dPIDj53VX9PxSxp4AaABAg,U dont need to be tech savy to use torrent,0,2024-04-05T16:09:34Z
UgxJzZISU22Z_Lv0kdR4AaABAg,Can watch anything for free thou,0,2024-04-05T16:08:40Z
UgxoNo9mzFnoe8eZuvV4AaABAg,usually love Vox but this just felt like an Ad.,1,2024-04-05T16:07:09Z
Ugxz1GL6DccRNOe26BZ4AaABAg,"Sure, I hopped around. But if I can't share my password with my family, even one month of service is not worth it. Especially if there's ads on top of that. Companies want to avoid that post covid consumer dip by inflating prices, but all they're doing is pushing loyal consumers to piracy. Cable died, what makes them think they'll be any different??",1,2024-04-05T16:06:42Z
UgwxRwk4VZQ2cwTjOr14AaABAg,"lol changed title
its time to pirate",0,2024-04-05T16:06:41Z
UgwM-RVkWIaGogjEXHF4AaABAg,"Many old tv shows are available from your local library. It’s free, just please return them on time.",0,2024-04-05T16:06:40Z
UgxaadiA9Qwc6-YqZwx4AaABAg,I stream everything on bootleg Mexican websites 😂,0,2024-04-05T16:06:16Z
Ugy6I3Z_aTdhRG_G7fl4AaABAg,Trying to convince family that they don’t need to watch everything is the hardest part.,20,2024-04-05T16:05:40Z
UgwLpFbbd5hqB_z3z6F4AaABAg,"you know TV nowadays is bad when even with the use of a pirate site with access to all the world's millions of hours of content, there's still nothing good to watch",46,2024-04-05T16:05:15Z
UgyWS5MQ_MGRonoJGgF4AaABAg,Is this a Jonas brother,2,2024-04-05T16:04:36Z
UgzUVEfhCZ0reWqRFLJ4AaABAg,Hello bittorrent my old friend,1,2024-04-05T16:04:30Z
Ugx_1EBomM6FnYLpd4V4AaABAg,"Cancel all the services ,and start sailing again,or start buying dvds again , atleast you own that copy , since buying isnt owning in the streaming world",0,2024-04-05T16:03:32Z
UgyN1CU_SbkoUnBUSid4AaABAg,*all aboard me maties!!!!* ☠,5,2024-04-05T16:03:19Z
UgwXwUTqZzBsq-xy3fF4AaABAg,"4:38 This is a splurge, not an investment.",0,2024-04-05T16:03:15Z
UgzsjeinJFpP4hi40jZ4AaABAg,"For churning, if you used the same email, would the streaming service have all your old data or a blank?",2,2024-04-05T16:02:13Z
UgyG4bgCQqXNfk7QjNp4AaABAg,i will be pirate king,0,2024-04-05T16:01:48Z
Ugyt4GmJYlm-CqU35tZ4AaABAg,Start sailing!,1,2024-04-05T16:00:47Z
UgzmIjSzSl6kHXnTQaZ4AaABAg,"It could have named a few more solutions and parts of solutions, even if not legal. Piracy is ramping up again because of this. And of course you have physical media.",0,2024-04-05T16:00:38Z
